{
  "source_pdf": "papers/literature/dataset_benchmark_papers/pdfs/pglib_opf/pglib_opf__OptiBench_An_Optimization_Benchmark_Tool_for_Renewable_Energy_Problems__8867e9f72b.pdf",
  "n_pages": 26,
  "sections": [
    {
      "id": "s1",
      "title": "Conclusion",
      "level": 1,
      "text": "Way forward\nNREL    |    3\nBackground\n Benchmarking the computational performance of software algorithms \nand hardware devices is an interdisciplinary practice.\n Advancements in optimization solvers, including the use of GPUs, have \nnot been well quantified across a diverse set of problems.\n Current benchmarking solutions need to be adapted to the diverse \nrange of renewable energy problems to study the efficient use of \ncompute capabilities including accelerators.\nNREL    |    4\nPhoto by Joe DelNero / NRELMotivation\nDevelop a user-friendly benchmarking tool to evaluate \nperformance of optimization solvers in solving \nrenewable energy problems on an HPC.\nNREL    |    5\nObjectives\n Develop a tool to benchmark renewable energy problems across a \nwide range of optimization solvers.\n Post-process and visualize benchmarking results for easy analysis.\n Utilize High-Performance Computing (HPC) resources to accelerate \nbenchmarking speed and expand capacity.\n Support GPU-based optimization solvers.\n1\n2\n3\n4\n5\n6\nNREL    |    6\nContents\nBackground and Motivation\nObjective\nOptiBench\nDemonstration",
      "refs": {
        "figures": [],
        "tables": [],
        "algorithms": [],
        "equations": []
      }
    },
    {
      "id": "s2",
      "title": "Conclusion",
      "level": 1,
      "text": "Way forward\nNREL    |    7\nOptiBench\n\nNREL    |    8\nCore features\nOptiBench offers following core features:",
      "refs": {
        "figures": [],
        "tables": [],
        "algorithms": [],
        "equations": []
      }
    },
    {
      "id": "s3",
      "title": "1 Asynchronous concurrent execution",
      "level": 1,
      "text": "",
      "refs": {
        "figures": [],
        "tables": [],
        "algorithms": [],
        "equations": []
      }
    },
    {
      "id": "s4",
      "title": "2 Raw optimization log parser",
      "level": 1,
      "text": "",
      "refs": {
        "figures": [],
        "tables": [],
        "algorithms": [],
        "equations": []
      }
    },
    {
      "id": "s5",
      "title": "3 Buffered meta-data logging",
      "level": 1,
      "text": "",
      "refs": {
        "figures": [],
        "tables": [],
        "algorithms": [],
        "equations": []
      }
    },
    {
      "id": "s6",
      "title": "4 Parallel/accelerated solver testing",
      "level": 1,
      "text": "OptiBench\nAsynchronous \nConcurrent \nExecution\nRaw Optimization \nLog Parser\nOptimization Meta-\ndata Logging\nParallel/Accelerate\nd Linear Solver \nSupport\nNREL    |    9\nQuiver: set of optimization solvers\n OptiBench is compatible with any \noptimization solvers supported by \nthe JuMP or NLPModels frameworks.\n OptiBench can directly benchmark \nwith optimization solver \nexecutables, in case the optimization \nsolver is not yet supported by Julia \n(such as Uno). \nTested solver Linear solvers\nIPOPT HSL, Mumps, Pardiso (MKL), SPRAL\nBonmin HSL, Mumps\nCouenne HSL, Mumps\nMadNLP HSL, Mumps, SPRAL\nGurobi N/A\nKNITRO HSL, Pardiso (MKL)\nXpress N/A\nCONOPT N/A\nUno MA57\nSCIP N/A\nAlpine Same as sub-optimizer\nNREL    |    10\nTarget: set of benchmarks\n OptiBench can benchmark any model \nin JuMP or NLPModels framework and \nread any model in the file formats \nlisted in the table to the right.\n OptiBench also supports any file \nformat supported by optimization \nsolver executable directly.\nFile format File extension\nConic benchmark format .cbf\nLinear programming format .lp\nMathOPT format .mof.json\nAMPL NL .nl\nREW .rew\nSDPA .sdpa\nSIF .sif\nPower Models file format .m\nNREL    |    11\nBenchmarks\nOptiBench has been evaluated with three benchmark suites of interest to \nrenewable energy research.\n CUTEst: Constrained and unconstrained testing environment with safe \nthreads\n PGlib-OPF: Power grid library for benchmarking optimal power flow \nalgorithms.\n WaterTAP: Open-source water treatment model library\nNREL    |    12\nPost-processor\nOptiBench’s post-processor visualizes \nbenchmarking results using interactive \nand intuitive plots.\n Cumulative time plots\n Performance profiles\n Robustness pie plots\n Heat maps\n Scatter plots \n\n1\n2\n3\n4\n5\n6\nNREL    |    13\nContents\nBackground and Motivation\nObjective\nOptiBench\nDemonstration",
      "refs": {
        "figures": [],
        "tables": [],
        "algorithms": [],
        "equations": []
      }
    },
    {
      "id": "s7",
      "title": "Conclusion",
      "level": 1,
      "text": "Way forward\nNREL    |    14\nDemonstration\n NREL’s Kestrel HPC CPU nodes: HPE Cray EX system,  2 × 52 dual socket Intel Xeon \nSapphire Rapids processor and 256 GB RAM.\n 1 node with 104 tasks per node and Julia v1.10.0 was used for the benchmark run.\n Benchmark sizes:\n• CUTEst: 1531 problems\n• PGLib-OPF: 199 problems\n• WaterTAP: 72 problems\n A total of 10 solver-linear solver combinations were compared in this section.",
      "refs": {
        "figures": [],
        "tables": [],
        "algorithms": [],
        "equations": []
      }
    }
  ],
  "figures": [],
  "tables": [],
  "algorithms": [],
  "equations": [],
  "signals": {
    "has_baseline_table": false,
    "has_ablation": false,
    "has_dataset_name": true,
    "has_data_availability": false,
    "has_code_availability": false,
    "section_roles": {
      "intro": false,
      "related": false,
      "method": false,
      "experiments": false,
      "discussion": false,
      "conclusion": true,
      "data_avail": false
    },
    "n_figures": 0,
    "n_tables": 0,
    "n_algorithms": 0,
    "n_equations": 0
  }
}