{
  "source_pdf": "papers/literature/dataset_benchmark_papers/pdfs/simbench/simbench__RL_for_distribution_grids__5b848d0ec4.pdf",
  "n_pages": 3,
  "sections": [
    {
      "id": "s1",
      "title": "INTRODUCTION",
      "level": 1,
      "text": "The description of the neutron star structure involves into consid eration the formalism of equations of state. We\nbelieve that the nonlocal rheological-type extension of the relativis tic non-equilibrium irreversible thermodynamics\nand thermostatics is the most interesting trend in this direction, an d in two recent works [1, 2] we have prepared the\ncorresponding mathematical basis. In the work [3] we have made t he trial step towards the description of rheological-\ntype equation of state for the neutron stars at zero temperatu re. In this note we suggest the new nonlocal model\nadapted for static spherically symmetric rheological systems. In t his context we consider the heat-ﬂux four-vector qk\nand the traceless part of the non-equilibrium pressure tensor Π (0)\nmn to be vanishing. We search for the scalar part of\nthe pressure tensor Π as a function of the radial variable r.",
      "refs": {
        "figures": [],
        "tables": [],
        "algorithms": [],
        "equations": []
      }
    },
    {
      "id": "s2",
      "title": "THE FORMALISM",
      "level": 1,
      "text": "A. Geometrical aspects of the theory\nWe use the canonic line element for the model of static spherically sym metric spacetime\nds2 = B(r)dt2 − A(r)dr2 − r2 (\ndθ2 + sin2 θdϕ 2)\n, B (∞) = 1 = A(∞) . (1)\nThe symmetry of this spacetime is described by the following Killing vect ors:\nξj\n(0) = δj\n0 , ξ j\n(1) = sin ϕδ j\nθ + cot θ cos ϕδ j\nϕ , ξ j\n(2) = cos ϕδ j\nθ − cot θ sin ϕδ j\nϕ , ξ j\n(ϕ ) = δj\nϕ . (2)\nOne obtains from (2) and (1) that the squares of the Killing vectors give the following relationships:\nξ2\n(0) ≡ gkjξk\n(0)ξj\n(0) = B , ξ 2\n(ϕ ) ≡ gkjξk\n(ϕ )ξj\n(ϕ ) = −r2 sin2 Θ , ξ 2\n(1) + ξ2\n(2) + ξ2\n(ϕ ) = −2r2 . (3)\nB. The velocity four-vector and the director\nThe velocity four-vector and its covariant derivative are, respec tively, of the form\nU i = δi\n0\n1\n√\nB\n, ∇kUi = −δ0\nkδr\ni\nB′\n2\n√\nB\n⇒ DUi ≡ U k∇kUi = −δr\ni\nB′\n2B . (4)\n∗ Electronic address: alexeyilinjukeu@gmail.com\n† Electronic address: Alexander.Balakin@kpfu.ru\n2\nThe prime denotes the derivative with respect to the radial variable . For these quantities we deal with the vanishing\nexpansion scalar (Θ = 0), shear tensor ( σik = 0), and vorticity tensor ( ω ik = 0); the only acceleration four-vector\nDUi is non-vanishing. With (4) the Eckart’s version of thermodynamics p redicts that, when the heat-ﬂux four-vector\nqk vanishes [4], the temperature T (r) is predetermined to be of the following form:\nqi = 0 ⇒ 1\nT\n⊥\n∇kT = DUk ⇒ T (r) = T (∞)√\nB(r)\n. (5)\nThe director Ri can be deﬁned as the unit spacelike four-vector orthogonal to th e velocity four-vector, which inherits\nthe symmetry of the spacetime, i.e.\nRiUi = 0 , RiRi = −1 , Lξ(a) Ri = ξk\n(a)∂kRi − Rk∂kξi\n(a) = 0 , (6)\nwhere Lξ(a) is the Lie derivatives along all the Killing vectors (2). All these require ments are satisﬁed for the four-vector\nRi = δi\nr\n1√\nA ; clearly, it possesses the following properties:\n∇kRi = 1\n2\n√\nA\n[ B′\nB δi\n0δ0\nk+ 2\nr\n(\nδi\nθδθ\nk+δi\nϕ δϕ\nk\n) ]\n, ∇kRk = 1\n2\n√\nA\n[ B′\nB + 4\nr\n]\n, Rk∇kRi = 0 , Rk∇kU i = 0 . (7)\nUsing the analogy with the convective derivative D ≡ U k∇k we introduce the directional derivative D ≡ R k∇k.\nFinally, keeping in mind that there exists the divergence-free timelike four-vector N k = nU k, ∇kN k = 0, with the\nparticle number density n, we introduce the new divergence-free spacelike four-vector M k = hRk, ∇kM k = 0. The\nmultiplier h is considered to be constructed using the moduli of the Killing vector s (2) as follows:\nh = h0\nξ(0)\n[\nξ2\n(1) + ξ2\n(2) + ξ2\n(ϕ )\n] ⇒ ∇ k\n(\nhRk)\n= 1\nr2√\nAB\nd\ndr\n[\n− h0\n2\n]\n= 0 . (8)\nC. Extension of the entropy ﬂux four-vector\nThe decomposition of the entropy ﬂux four-vector Sk can be organized, e.g., as follows:\nSk = Sk\n(IS) + hRk\n{\nD−1(Π f (T )) + 1\n2\n[\nD−1Π\n] 2\n+ 1\n2 τΠ 2\n}\n, (9)\nwhere the contribution Sk\n(IS) appeared in the Israel-Stewart theory [5]. Here τ is a constant and f (T ) is some function\nof the temperature. The inverse operator D−1 is deﬁned as\nDD−1Π = Π ⇒ D −1Π =\n∫ r\n∞\ndrΠ( r)\n√\nA(r) . (10)\nFor the static spherically symmetric model the entropy production scalar takes the form\nσ = ∇kSk = hΠ\n[\nf (T ) + D−1Π + τDΠ\n]\n= Π 2\n9ζ ≥ 0 , (11)\nwhere ζ is some function of the temperature. Thus, the non-equilibrium pre ssure Π has to satisfy the integro-diﬀerential\nequation\nτDΠ − Π\n9ζh + f (T ) + D−1Π = 0 . (12)\nThe pure diﬀerential version of this equation is\nτD2Π − 1\n9ζh DΠ + Π\n[\n1 − D\n( 1\n9ζh\n)]\n+ d f\ndT DT = 0 . (13)\nWe deal with the linear diﬀerential equation of the second order kno wn as the Burgers constitutive equation [6].\nThe inhomogeneity of the temperature with the law DT = − T (∞)B′(r)\n2\n√\nAB3 predetermines the features of the pressure\ndistribution Π( r); when f (T ) = const the equation (13) admits the vanishing pressure Π = 0.\n3",
      "refs": {
        "figures": [],
        "tables": [],
        "algorithms": [],
        "equations": []
      }
    },
    {
      "id": "s3",
      "title": "OUTLOOK",
      "level": 1,
      "text": "The equation (13) gives us the new equation describing the proﬁles o f the non-equilibrium pressure Π( r) in the\nmodel of static spherically symmetric object. The next step we hav e to do is to formulate the extended equation\nof hydrostatic equilibrium, which is the key element of the analysis of t he star structure. We hope to analyze this\nproblem in the nearest future.",
      "refs": {
        "figures": [],
        "tables": [],
        "algorithms": [],
        "equations": []
      }
    }
  ],
  "figures": [],
  "tables": [],
  "algorithms": [],
  "equations": [
    {
      "id": "e13",
      "latex_or_text": "equation (13)"
    }
  ],
  "signals": {
    "has_baseline_table": false,
    "has_ablation": false,
    "has_dataset_name": false,
    "has_data_availability": false,
    "has_code_availability": false,
    "section_roles": {
      "intro": true,
      "related": false,
      "method": false,
      "experiments": false,
      "discussion": false,
      "conclusion": false,
      "data_avail": false
    },
    "n_figures": 0,
    "n_tables": 0,
    "n_algorithms": 0,
    "n_equations": 1
  }
}